[
  {
    "schema_version": "observation_ledger.case.v1",
    "case_id": "obs-gd-001",
    "suite": "observations",
    "behavioral_buckets": [
      "goal_decision",
      "goal",
      "explicit_outcome",
      "deadline"
    ],
    "privacy_classification": "public",
    "source_events": [
      {
        "event_id": "event-gd-001",
        "tenant_id": "public-benchmark-tenant",
        "event_time": "2026-08-01T10:00:00Z",
        "source_kind": "conversation_turn",
        "content": "User: Our goal is to launch the pilot to five clinics by October 1.\nAgent: I will record that as the stated pilot goal, not as a completed launch."
      }
    ],
    "admissible_evidence": [
      {
        "evidence_id": "ev-001-user",
        "source_event_id": "event-gd-001",
        "tenant_id": "public-benchmark-tenant",
        "actor_role": "user",
        "content": "Our goal is to launch the pilot to five clinics by October 1.",
        "span": {
          "start": 6,
          "end": 67
        }
      },
      {
        "evidence_id": "ev-001-agent",
        "source_event_id": "event-gd-001",
        "tenant_id": "public-benchmark-tenant",
        "actor_role": "agent",
        "content": "I will record that as the stated pilot goal, not as a completed launch.",
        "span": {
          "start": 75,
          "end": 146
        }
      }
    ],
    "task_input": {
      "tenant_id": "public-benchmark-tenant",
      "task_type": "annotate_event",
      "operation": "annotate_event.v1",
      "prompt_version": "observation.goal_decision.v1",
      "instruction": "Author one evidence-bound ObservationBead and only warranted optional semantics."
    },
    "expected_structural_behavior": {
      "output_contract": "core-memory.annotation-bundle.v1",
      "required_output_fields": [
        "primary_label",
        "facets",
        "title",
        "summary",
        "evidence_refs",
        "retrieval_eligible",
        "assertions",
        "associations",
        "revisions",
        "limitations"
      ],
      "forbidden_output_fields": [
        "gold",
        "accepted_gold",
        "adjudication",
        "judge_critique",
        "oracle_answer"
      ],
      "requires_citations": true,
      "assertions_may_be_empty": true,
      "exactly_one_observation_bead": true,
      "source_event_lineage_count": 1
    },
    "evidence_checksum": "938e06b711bcfd98f3adc399b1984c865e6f4a43b93673d9d2b7666adbd69866"
  },
  {
    "schema_version": "observation_ledger.case.v1",
    "case_id": "obs-gd-002",
    "suite": "observations",
    "behavioral_buckets": [
      "goal_decision",
      "goal",
      "measurable_outcome",
      "quality_target"
    ],
    "privacy_classification": "public",
    "source_events": [
      {
        "event_id": "event-gd-002",
        "tenant_id": "public-benchmark-tenant",
        "event_time": "2026-08-02T10:00:00Z",
        "source_kind": "conversation_turn",
        "content": "User: I want the next release to keep p95 latency below 200 milliseconds under the documented load test.\nAgent: That gives us a measurable performance goal; it does not show that the target is currently met."
      }
    ],
    "admissible_evidence": [
      {
        "evidence_id": "ev-002-user",
        "source_event_id": "event-gd-002",
        "tenant_id": "public-benchmark-tenant",
        "actor_role": "user",
        "content": "I want the next release to keep p95 latency below 200 milliseconds under the documented load test.",
        "span": {
          "start": 6,
          "end": 104
        }
      },
      {
        "evidence_id": "ev-002-agent",
        "source_event_id": "event-gd-002",
        "tenant_id": "public-benchmark-tenant",
        "actor_role": "agent",
        "content": "That gives us a measurable performance goal; it does not show that the target is currently met.",
        "span": {
          "start": 112,
          "end": 207
        }
      }
    ],
    "task_input": {
      "tenant_id": "public-benchmark-tenant",
      "task_type": "annotate_event",
      "operation": "annotate_event.v1",
      "prompt_version": "observation.goal_decision.v1",
      "instruction": "Author one evidence-bound ObservationBead and only warranted optional semantics."
    },
    "expected_structural_behavior": {
      "output_contract": "core-memory.annotation-bundle.v1",
      "required_output_fields": [
        "primary_label",
        "facets",
        "title",
        "summary",
        "evidence_refs",
        "retrieval_eligible",
        "assertions",
        "associations",
        "revisions",
        "limitations"
      ],
      "forbidden_output_fields": [
        "gold",
        "accepted_gold",
        "adjudication",
        "judge_critique",
        "oracle_answer"
      ],
      "requires_citations": true,
      "assertions_may_be_empty": true,
      "exactly_one_observation_bead": true,
      "source_event_lineage_count": 1
    },
    "evidence_checksum": "82c5f07620b0ad1e8d4adcb20d76f57712b9cd35fb22988b768d920708a180a7"
  },
  {
    "schema_version": "observation_ledger.case.v1",
    "case_id": "obs-gd-003",
    "suite": "observations",
    "behavioral_buckets": [
      "goal_decision",
      "goal",
      "goal_task_boundary",
      "documentation"
    ],
    "privacy_classification": "public",
    "source_events": [
      {
        "event_id": "event-gd-003",
        "tenant_id": "public-benchmark-tenant",
        "event_time": "2026-08-03T10:00:00Z",
        "source_kind": "conversation_turn",
        "content": "User: The goal is for a new engineer to complete setup unaided; rewriting the install guide is only one possible task.\nAgent: Understood: successful unaided setup is the outcome, and the guide rewrite is not itself the goal."
      }
    ],
    "admissible_evidence": [
      {
        "evidence_id": "ev-003-user",
        "source_event_id": "event-gd-003",
        "tenant_id": "public-benchmark-tenant",
        "actor_role": "user",
        "content": "The goal is for a new engineer to complete setup unaided; rewriting the install guide is only one possible task.",
        "span": {
          "start": 6,
          "end": 118
        }
      },
      {
        "evidence_id": "ev-003-agent",
        "source_event_id": "event-gd-003",
        "tenant_id": "public-benchmark-tenant",
        "actor_role": "agent",
        "content": "Understood: successful unaided setup is the outcome, and the guide rewrite is not itself the goal.",
        "span": {
          "start": 126,
          "end": 224
        }
      }
    ],
    "task_input": {
      "tenant_id": "public-benchmark-tenant",
      "task_type": "annotate_event",
      "operation": "annotate_event.v1",
      "prompt_version": "observation.goal_decision.v1",
      "instruction": "Author one evidence-bound ObservationBead and only warranted optional semantics."
    },
    "expected_structural_behavior": {
      "output_contract": "core-memory.annotation-bundle.v1",
      "required_output_fields": [
        "primary_label",
        "facets",
        "title",
        "summary",
        "evidence_refs",
        "retrieval_eligible",
        "assertions",
        "associations",
        "revisions",
        "limitations"
      ],
      "forbidden_output_fields": [
        "gold",
        "accepted_gold",
        "adjudication",
        "judge_critique",
        "oracle_answer"
      ],
      "requires_citations": true,
      "assertions_may_be_empty": true,
      "exactly_one_observation_bead": true,
      "source_event_lineage_count": 1
    },
    "evidence_checksum": "25716fe3b718bcc336e204e28d0c35d804f92303b8af81a4c7f1a8e6b67fa08a"
  },
  {
    "schema_version": "observation_ledger.case.v1",
    "case_id": "obs-gd-004",
    "suite": "observations",
    "behavioral_buckets": [
      "goal_decision",
      "goal",
      "tentative_goal",
      "uncertainty"
    ],
    "privacy_classification": "public",
    "source_events": [
      {
        "event_id": "event-gd-004",
        "tenant_id": "public-benchmark-tenant",
        "event_time": "2026-08-04T10:00:00Z",
        "source_kind": "conversation_turn",
        "content": "User: I would like to make the archive searchable eventually, but I am not committing to that scope this quarter.\nAgent: I will treat searchable archives as a tentative longer-term goal, not a current-quarter commitment."
      }
    ],
    "admissible_evidence": [
      {
        "evidence_id": "ev-004-user",
        "source_event_id": "event-gd-004",
        "tenant_id": "public-benchmark-tenant",
        "actor_role": "user",
        "content": "I would like to make the archive searchable eventually, but I am not committing to that scope this quarter.",
        "span": {
          "start": 6,
          "end": 113
        }
      },
      {
        "evidence_id": "ev-004-agent",
        "source_event_id": "event-gd-004",
        "tenant_id": "public-benchmark-tenant",
        "actor_role": "agent",
        "content": "I will treat searchable archives as a tentative longer-term goal, not a current-quarter commitment.",
        "span": {
          "start": 121,
          "end": 220
        }
      }
    ],
    "task_input": {
      "tenant_id": "public-benchmark-tenant",
      "task_type": "annotate_event",
      "operation": "annotate_event.v1",
      "prompt_version": "observation.goal_decision.v1",
      "instruction": "Author one evidence-bound ObservationBead and only warranted optional semantics."
    },
    "expected_structural_behavior": {
      "output_contract": "core-memory.annotation-bundle.v1",
      "required_output_fields": [
        "primary_label",
        "facets",
        "title",
        "summary",
        "evidence_refs",
        "retrieval_eligible",
        "assertions",
        "associations",
        "revisions",
        "limitations"
      ],
      "forbidden_output_fields": [
        "gold",
        "accepted_gold",
        "adjudication",
        "judge_critique",